[
  {
    "id": "terrain_air",
    "tags": ["empty", "passable"],
    "material": "core_mat_air",
    "terrain_bits": {
      "kind": "OpenNoFloor",
      "natural": true,
      "support_flag": false
    },
    "display": {
      "glyph": 32,
      "foreground": {"r": 0, "g": 0, "b": 0},
      "background": {"r": 0, "g": 0, "b": 0}
    },
    "properties": {
      "mineable": false,
      "buildable": false,
      "smoothable": false,
      "nav_cost_base": 10,
      "opacity": 0
    }
  },
  {
    "id": "terrain_granite_wall",
    "tags": ["stone", "wall", "igneous"],
    "material": "core_mat_stone_granite",
    "terrain_bits": {
      "kind": "SolidWall",
      "natural": true,
      "support_flag": true
    },
    "display": {
      "glyph": 219,
      "foreground": {"r": 139, "g": 69, "b": 69},
      "background": {"r": 0, "g": 0, "b": 0},
      "autotile": {
        "connect_groups": ["wall_stone"],
        "connects_to": ["wall_stone"],
        "variants": {
          "solo": 219,
          "end_n": 186,
          "end_e": 185,
          "end_s": 186,
          "end_w": 185,
          "corner_ne": 187,
          "corner_se": 188,
          "corner_sw": 200,
          "corner_nw": 201,
          "straight_ns": 186,
          "straight_ew": 205,
          "tee_n": 202,
          "tee_e": 204,
          "tee_s": 203,
          "tee_w": 185,
          "cross": 206
        }
      }
    },
    "properties": {
      "mineable": true,
      "buildable": false,
      "smoothable": true,
      "nav_cost_base": 999,
      "opacity": 100,
      "layer_depth": 10
    }
  },
  {
    "id": "terrain_granite_floor",
    "tags": ["stone", "floor", "igneous"],
    "material": "core_mat_stone_granite",
    "terrain_bits": {
      "kind": "OpenWithFloor",
      "natural": true,
      "support_flag": false
    },
    "display": {
      "glyph": 46,
      "foreground": {"r": 100, "g": 50, "b": 50},
      "background": {"r": 0, "g": 0, "b": 0}
    },
    "properties": {
      "mineable": false,
      "buildable": true,
      "smoothable": true,
      "nav_cost_base": 10,
      "opacity": 0
    }
  },
  {
    "id": "terrain_marble_wall",
    "tags": ["stone", "wall", "metamorphic"],
    "material": "core_mat_stone_marble",
    "terrain_bits": {
      "kind": "SolidWall",
      "natural": true,
      "support_flag": true
    },
    "display": {
      "glyph": 219,
      "foreground": {"r": 240, "g": 240, "b": 240},
      "background": {"r": 0, "g": 0, "b": 0},
      "autotile": {
        "connect_groups": ["wall_stone"],
        "connects_to": ["wall_stone"]
      }
    },
    "properties": {
      "mineable": true,
      "buildable": false,
      "smoothable": true,
      "nav_cost_base": 999,
      "opacity": 100,
      "layer_depth": 8
    }
  },
  {
    "id": "terrain_basalt_wall",
    "tags": ["stone", "wall", "volcanic"],
    "material": "core_mat_stone_basalt",
    "terrain_bits": {
      "kind": "SolidWall",
      "natural": true,
      "support_flag": true
    },
    "display": {
      "glyph": 219,
      "foreground": {"r": 50, "g": 50, "b": 50},
      "background": {"r": 0, "g": 0, "b": 0},
      "autotile": {
        "connect_groups": ["wall_stone"],
        "connects_to": ["wall_stone"]
      }
    },
    "properties": {
      "mineable": true,
      "buildable": false,
      "smoothable": true,
      "nav_cost_base": 999,
      "opacity": 100,
      "layer_depth": 12
    }
  },
  {
    "id": "terrain_sandstone_wall",
    "tags": ["stone", "wall", "sedimentary"],
    "material": "core_mat_stone_sandstone",
    "terrain_bits": {
      "kind": "SolidWall",
      "natural": true,
      "support_flag": true
    },
    "display": {
      "glyph": 219,
      "foreground": {"r": 210, "g": 180, "b": 140},
      "background": {"r": 0, "g": 0, "b": 0},
      "autotile": {
        "connect_groups": ["wall_stone"],
        "connects_to": ["wall_stone"]
      }
    },
    "properties": {
      "mineable": true,
      "buildable": false,
      "smoothable": true,
      "nav_cost_base": 999,
      "opacity": 100,
      "layer_depth": 15
    }
  },
  {
    "id": "terrain_limestone_wall",
    "tags": ["stone", "wall", "sedimentary"],
    "material": "core_mat_stone_limestone",
    "terrain_bits": {
      "kind": "SolidWall",
      "natural": true,
      "support_flag": true
    },
    "display": {
      "glyph": 219,
      "foreground": {"r": 192, "g": 192, "b": 192},
      "background": {"r": 0, "g": 0, "b": 0},
      "autotile": {
        "connect_groups": ["wall_stone"],
        "connects_to": ["wall_stone"]
      }
    },
    "properties": {
      "mineable": true,
      "buildable": false,
      "smoothable": true,
      "nav_cost_base": 999,
      "opacity": 100,
      "layer_depth": 20
    }
  },
  {
    "id": "terrain_shale_wall",
    "tags": ["stone", "wall", "sedimentary"],
    "material": "core_mat_stone_shale",
    "terrain_bits": {
      "kind": "SolidWall",
      "natural": true,
      "support_flag": true
    },
    "display": {
      "glyph": 219,
      "foreground": {"r": 112, "g": 128, "b": 144},
      "background": {"r": 0, "g": 0, "b": 0},
      "autotile": {
        "connect_groups": ["wall_stone"],
        "connects_to": ["wall_stone"]
      }
    },
    "properties": {
      "mineable": true,
      "buildable": false,
      "smoothable": true,
      "nav_cost_base": 999,
      "opacity": 100,
      "layer_depth": 18
    }
  },
  {
    "id": "terrain_grass",
    "tags": ["soil", "surface", "vegetation"],
    "material": "core_mat_soil_grass",
    "terrain_bits": {
      "kind": "OpenWithFloor",
      "natural": true,
      "support_flag": false
    },
    "display": {
      "glyph": 46,
      "foreground": {"r": 0, "g": 255, "b": 0},
      "background": {"r": 0, "g": 0, "b": 0}
    },
    "properties": {
      "mineable": false,
      "buildable": true,
      "smoothable": false,
      "nav_cost_base": 10,
      "opacity": 0,
      "flammable": true
    }
  },
  {
    "id": "terrain_dirt",
    "tags": ["soil", "surface"],
    "material": "core_mat_soil_dirt",
    "terrain_bits": {
      "kind": "OpenWithFloor",
      "natural": true,
      "support_flag": false
    },
    "display": {
      "glyph": 46,
      "foreground": {"r": 139, "g": 90, "b": 43},
      "background": {"r": 0, "g": 0, "b": 0}
    },
    "properties": {
      "mineable": false,
      "buildable": true,
      "smoothable": false,
      "nav_cost_base": 10,
      "opacity": 0
    }
  },
  {
    "id": "terrain_sand",
    "tags": ["soil", "surface", "granular"],
    "material": "core_mat_soil_sand",
    "terrain_bits": {
      "kind": "OpenWithFloor",
      "natural": true,
      "support_flag": false
    },
    "display": {
      "glyph": 247,
      "foreground": {"r": 255, "g": 255, "b": 0},
      "background": {"r": 0, "g": 0, "b": 0}
    },
    "properties": {
      "mineable": false,
      "buildable": true,
      "smoothable": false,
      "nav_cost_base": 12,
      "opacity": 0
    }
  },
  {
    "id": "terrain_mud",
    "tags": ["soil", "surface", "wet"],
    "material": "core_mat_soil_mud",
    "terrain_bits": {
      "kind": "OpenWithFloor",
      "natural": true,
      "support_flag": false
    },
    "display": {
      "glyph": 247,
      "foreground": {"r": 139, "g": 69, "b": 19},
      "background": {"r": 0, "g": 0, "b": 0}
    },
    "properties": {
      "mineable": false,
      "buildable": false,
      "smoothable": false,
      "nav_cost_base": 15,
      "opacity": 0
    }
  },
  {
    "id": "terrain_snow",
    "tags": ["frozen", "surface", "cold"],
    "material": "core_mat_snow",
    "terrain_bits": {
      "kind": "OpenWithFloor",
      "natural": true,
      "support_flag": false
    },
    "display": {
      "glyph": 42,
      "foreground": {"r": 255, "g": 255, "b": 255},
      "background": {"r": 0, "g": 0, "b": 0}
    },
    "properties": {
      "mineable": false,
      "buildable": true,
      "smoothable": false,
      "nav_cost_base": 11,
      "opacity": 0
    }
  },
  {
    "id": "terrain_cavern_floor",
    "tags": ["underground", "cavern", "natural"],
    "material": "core_mat_stone_limestone",
    "terrain_bits": {
      "kind": "OpenWithFloor",
      "natural": true,
      "support_flag": false
    },
    "display": {
      "glyph": 46,
      "foreground": {"r": 105, "g": 105, "b": 105},
      "background": {"r": 0, "g": 0, "b": 0}
    },
    "properties": {
      "mineable": false,
      "buildable": true,
      "smoothable": true,
      "nav_cost_base": 10,
      "opacity": 0
    }
  },
  {
    "id": "terrain_ore_iron",
    "tags": ["ore", "valuable", "mineable"],
    "material": "core_mat_ore_iron",
    "terrain_bits": {
      "kind": "SolidWall",
      "natural": true,
      "support_flag": true
    },
    "display": {
      "glyph": 15,
      "foreground": {"r": 255, "g": 215, "b": 0},
      "background": {"r": 0, "g": 0, "b": 0},
      "autotile": {
        "connect_groups": ["ore_vein"],
        "connects_to": ["ore_vein", "wall_stone"]
      }
    },
    "properties": {
      "mineable": true,
      "buildable": false,
      "smoothable": false,
      "nav_cost_base": 999,
      "opacity": 100,
      "ore_chance": 0.05
    }
  },
  {
    "id": "terrain_ore_gold",
    "tags": ["ore", "precious", "valuable"],
    "material": "core_mat_ore_gold",
    "terrain_bits": {
      "kind": "SolidWall",
      "natural": true,
      "support_flag": true
    },
    "display": {
      "glyph": 15,
      "foreground": {"r": 255, "g": 215, "b": 0},
      "background": {"r": 0, "g": 0, "b": 0},
      "autotile": {
        "connect_groups": ["ore_vein"],
        "connects_to": ["ore_vein", "wall_stone"]
      }
    },
    "properties": {
      "mineable": true,
      "buildable": false,
      "smoothable": false,
      "nav_cost_base": 999,
      "opacity": 100,
      "ore_chance": 0.01
    }
  },
  {
    "id": "terrain_stairs_up",
    "tags": ["constructed", "vertical", "access"],